{
  "type": "approval_request_created",
  "event_id": "7217400317439950009",
  "chat_id": null,
  "data": {
    "request": {
      "id": "5",
      "type": "direct_message",
      "status": "pending",
      "requester": {
        "id": "1001",
        "username": "alice",
        "display_name": "Alice",
        "avatar_url": "/api/v2/users/1001/avatar",
        "bio": null,
        "is_online": true,
        "last_seen": null,
        "is_deleted": false
      },
      "group_name": null,
      "preview": "Hi, can we talk?",
      "created_at": "2026-10-04T12:00:00Z"
    }
  }
}
